{
  "$schema": "http://json-schema.org/draft-07/schema#",
  "title": "Hacker Evolution Exploit Schema",
  "description": "Schema for exploit (Darknet) JSON files in data/exploits*.json",
  "type": "array",
  "items": {
    "type": "object",
    "properties": {
      "id": {
        "type": "string",
        "description": "Unique exploit identifier"
      },
      "name": {
        "type": "string",
        "description": "Display name"
      },
      "desc": {
        "type": "string",
        "description": "Description / flavour text"
      },
      "cost": {
        "type": "integer",
        "minimum": 0,
        "description": "Purchase cost in dollars"
      },
      "level": {
        "type": "integer",
        "minimum": 1,
        "description": "Minimum player level to purchase"
      },
      "type": {
        "type": "string",
        "description": "Exploit category",
        "enum": ["tool", "virus", "exploit", "software", "hardware"]
      },
      "effect": {
        "type": "string",
        "description": "Gameplay effect key"
      },
      "content": {
        "type": "string",
        "description": "Content / install instructions"
      }
    },
    "required": ["id", "name", "desc", "cost"]
  }
}
