[
  {
    "id": "sql_injector_v1",
    "name": "SQL_Injector_v1.exe",
    "desc": "SQL injection exploit for database servers",
    "cost": 800,
    "level": 1,
    "type": "exploit",
    "effect": "instant_crack",
    "content": "# SQL_Injector_v1\n# SQL injection payload\n# Usage: EXEC SQL_Injector_v1.exe <host> [port]\n# Instantly cracks the target port if the server runs a database."
  },
  {
    "id": "brute_force_v2",
    "name": "Brute_Force_Tool_v2.exe",
    "desc": "Advanced brute-force with rainbow tables",
    "cost": 1500,
    "level": 2,
    "type": "exploit",
    "effect": "speed_crack",
    "content": "# Brute_Force_Tool_v2\n# Rainbow-table accelerated brute-force\n# Usage: EXEC Brute_Force_Tool_v2.exe <host> [port]\n# 3x crack speed on target port."
  },
  {
    "id": "packet_sniffer",
    "name": "Packet_Sniffer_v3.exe",
    "desc": "Network sniffer that reveals all neighbor connections",
    "cost": 2000,
    "level": 3,
    "type": "tool",
    "effect": "reveal_network",
    "content": "# Packet_Sniffer_v3\n# Deep packet inspection tool\n# Usage: EXEC Packet_Sniffer_v3.exe\n# Reveals all hidden neighbors of the connected server."
  },
  {
    "id": "decrypt_booster",
    "name": "Decrypt_Booster_v1.exe",
    "desc": "Hardware-accelerated decryption coprocessor",
    "cost": 3000,
    "level": 4,
    "type": "tool",
    "effect": "speed_decrypt",
    "content": "# Decrypt_Booster_v1\n# GPU-assisted decryption\n# Usage: EXEC Decrypt_Booster_v1.exe <host>\n# Instantly decrypts the target server key."
  },
  {
    "id": "stealth_kit",
    "name": "Stealth_Kit_v2.exe",
    "desc": "Cloaking tool that reduces trace on all actions",
    "cost": 2500,
    "level": 3,
    "type": "tool",
    "effect": "stealth_boost",
    "content": "# Stealth_Kit_v2\n# Active camouflage for network traffic\n# Usage: EXEC Stealth_Kit_v2.exe\n# Reduces trace accumulation by 50% for 5 actions."
  },
  {
    "id": "worm_deluxe",
    "name": "Worm_Deluxe_v4.exe",
    "desc": "Self-replicating worm that auto-hacks connected servers",
    "cost": 5000,
    "level": 5,
    "type": "worm",
    "effect": "auto_spread",
    "content": "# Worm_Deluxe_v4\n# Autonomous spreading worm\n# Usage: EXEC Worm_Deluxe_v4.exe <host>\n# Automatically cracks all neighboring servers."
  },
  {
    "id": "firewall_bypass",
    "name": "Firewall_Bypass_v1.exe",
    "desc": "Bypasses the Sentinel firewall for 60 seconds",
    "cost": 4000,
    "level": 4,
    "type": "exploit",
    "effect": "sentinel_bypass",
    "content": "# Firewall_Bypass_v1\n# Sentinel firewall evasion\n# Usage: EXEC Firewall_Bypass_v1.exe\n# Temporarily suppresses Sentinel AI responses."
  },
  {
    "id": "crypto_miner",
    "name": "Crypto_Miner_v3.exe",
    "desc": "Covert miner that boosts crypto earnings",
    "cost": 1200,
    "level": 2,
    "type": "tool",
    "effect": "crypto_boost",
    "content": "# Crypto_Miner_v3\n# Stealth cryptocurrency miner\n# Usage: EXEC Crypto_Miner_v3.exe\n# Boosts crypto trading profits by 50%."
  },
  {
    "id": "trace_killer",
    "name": "Trace_Killer_v1.exe",
    "desc": "Resets trace level to 0 immediately",
    "cost": 6000,
    "level": 5,
    "type": "tool",
    "effect": "trace_reset",
    "content": "# Trace_Killer_v1\n# Emergency trace purge\n# Usage: EXEC Trace_Killer_v1.exe\n# Resets trace to 0% (one-time use)."
  },
  {
    "id": "scan_probe",
    "name": "Scan_Probe_v5.exe",
    "desc": "Deep scan that reveals all servers on the network",
    "cost": 1000,
    "level": 1,
    "type": "scanner",
    "effect": "global_reveal",
    "content": "# Scan_Probe_v5\n# Deep network probe\n# Usage: EXEC Scan_Probe_v5.exe\n# Reveals every server in the network."
  }
]
